Table,Field,ShortDesc,Description,DataType,VisibleInRanking
"tblS2ToxicsWorstCase","PercentWeight","2.1.b Percent weight of chemical in mixture","Percent weight of a toxic chemical in a mixture.","Single",1
"tblS2ToxicsWorstCase","PhysicalState",,"Code representing the physical state of the regulated chemical as it is  released in the scenario.","Text",0
"tblS2ToxicsWorstCase","PM_Berms",,"An indication that a mound or wall of earth at the top or bottom of a slope that prevents a spill from spreading is in place.","Yes/No",0
"tblS2ToxicsWorstCase","PM_Dikes",,"An indication that a low wall that acts as a barrier to prevent a spill from spreading is in place.","Yes/No",0
"tblS2ToxicsWorstCase","PM_Drains",,"An indication that a channel that carries off surface water is in place.","Yes/No",0
"tblS2ToxicsWorstCase","PM_Enclosures",,"An indication that a physical containment of the release within a structure (e.g., a building) is in place.","Yes/No",0
"tblS2ToxicsWorstCase","PM_OtherType",,"The Passive Mitigation type considered if other than those listed above.","Text",0
"tblS2ToxicsWorstCase","PM_Sumps",,"An indication that a pit or tank that catches liquid runoff for drainage or disposal is in place.","Yes/No",0
"tblS2ToxicsWorstCase","PR_Comm_Ind",,"Indication that a major commercial, office, or industrial area is within the distance to the endpoint specified in the worst case scenario. These include
industrial parks, office buildings, shopping malls, commercial areas.","Yes/No",0
"tblS2ToxicsWorstCase","PR_Hospitals",,"Indication that a hospital is within the distance to the endpoint specified in the worst case scenario.","Yes/No",0
"tblS2ToxicsWorstCase","PR_OtherType",,"The type of public receptor if the public receptor is other than those listed in 2.13.a. through 2.13.f.","Text",0
"tblS2ToxicsWorstCase","PR_Prisons",,"Indication that a prison or correction facility is within the distance to the endpoint specified in the worst case scenario.","Yes/No",0
"tblS2ToxicsWorstCase","PR_PublicRecreation",,"Indication that a recreational area or arena is within the distance to the endpoint specified in the worst case scenario.  These include stadiums, parks, and public pools.","Yes/No",0
"tblS2ToxicsWorstCase","PR_Residences",,"Indication that residences are within the distance to the endpoint specified in the worst case scenario.","Yes/No",0
"tblS2ToxicsWorstCase","PR_Schools",,"Indication that a school is within the distance to the endpoint specified in the worst case scenario. Schools include: public and private elementary,
secondary, and higher education schools.","Yes/No",0
"tblS2ToxicsWorstCase","ProcessChemicalID",,"Unique number used to identify each chemical in a process.  From Section 1 Chemicals in Covered Process.","Long Integer",0
"tblS2ToxicsWorstCase","ptrGraphic",,"The DOS file name for the toxics worst case graphic accompanying the scenario.  Should be “.JPG,” or “.GIF” with up to an 8-character prefix.","Text",0
"tblS2ToxicsWorstCase","QuantityReleased","2.5 Quantity released (lbs)","The quantity of the chemical released in pounds during the worst case scenario.","Double",1
"tblS2ToxicsWorstCase","ReleaseDuration","2.7 Release duration (min)","Indicate the length of time in minutes for the vessel, pipeline, or other location of the regulated substance to release all of its contents.  For gasses, the duration is 10 minutes.","Single",1
"tblS2ToxicsWorstCase","ReleaseRate","2.6 Release rate (lbs/min)","The release rate of the chemical in pounds per minute.","Double",1
"tblS2ToxicsWorstCase","ResidentialPopulation","2.12 Residential population within distance to endpoint","Population within the distance to endpoint of the area encompassed by the endpoint.  Need only include residential populations and may be rounded to two significant digits.","Long Integer",1
"tblS2ToxicsWorstCase","Scenario",,"A code representing the toxics worst case scenario.","Text",0
"tblS2ToxicsWorstCase","StabilityClass",,"Stability Class - “F” unless local meteorological data can demonstrate otherwise.","Text",0
"tblS2ToxicsWorstCase","Topography",,"A code representing whether the local topography is urban or rural.","Text",0
"tblS2ToxicsWorstCase","ToxicID",,"Unique identifier for Section 2 Toxics Worst Case record destination table.  Generated by RMP*Submit and 3rd-party programs.","Long Integer",0
"tblS2ToxicsWorstCase","WindSpeed",,"The wind speed in meters per second. This is 1.5 meters per second unless local meteorological data applicable to the source is used to show a higher
minimum wind speed at all times during the last 3 years.","Single",0
"tblS3ToxicsAltReleases","AM_DelugeSystems",,"A system to overflow an area of a release with water or other extinguishing fluid.","Yes/No",0
"tblS3ToxicsAltReleases","AM_EmergencyShutdown",,"Controls that are triggered when process limits are exceeded and that shut down that process.","Yes/No",0
"tblS3ToxicsAltReleases","AM_ExcessFlowValve",,"A system for diverting overflow.","Yes/No",0
"tblS3ToxicsAltReleases","AM_Flares",,"A device for disposing of combustible gases from a chemical process by burning them in the open.","Yes/No",0
"tblS3ToxicsAltReleases","AM_Neutralization",,"Making a toxic chemical harmless through chemical reaction.","Yes/No",0
"tblS3ToxicsAltReleases","AM_OtherType",,"The type of active mitigation in place if other than those listed in 3.16.a. through 3.16.h.","Text",0
"tblS3ToxicsAltReleases","AM_Scrubbers",,"A pre-release protection measure that uses water or aqueous mixtures containing scrubbing reagents to remove discharging liquids and possibly also treating the discharging chemical.","Yes/No",0
"tblS3ToxicsAltReleases","AM_SprinklerSystems",,"A system for protecting a building against fire by means of overhead pipes which convey an extinguishing fluid through heat activated outlets.","Yes/No",0
"tblS3ToxicsAltReleases","AM_WaterCurtain",,"A spray of water from a horizontal pipe through nozzles, the curtain may be activated manually or automatically.","Yes/No",0
"tblS3ToxicsAltReleases","AnalyticalBasis",,"The analytical basis for choosing the Toxics Alternative Release Scenario.  Users may add their own data source if it is not on the list.  One of the
following is expected:
EPA’s OCA Guidance Reference Tables or Equations; 
EPA’s RMP Guidance for Ammonia Refrigeration
Reference Tables or Equations;
EPA’s RMP Guidance for Wastewater Treatment
Plants Reference Tables or Equations;
EPA’s RMP Guidance for Warehouses Reference
Tables or Equations;
EPA’s RMP Guidance for Chemical Distributors
Reference Tables or Equations;
EPA’s RMP*Comp (TM);
Areal Locations of Hazardous Atmosphere
[Aloha(R)];
Other Model Name.","Text",0
"tblS3ToxicsAltReleases","CBI_Flag",,"Set if record contains CBI data.","Yes/No",0
"tblS3ToxicsAltReleases","Distance2Endpoint","3.11 Distance to endpoint  (miles)","The distance to the endpoint of the toxics alternative release scenario in miles using the endpoint specified for the chemical in Appendix A of the Risk Management Program Rule.","Single",1
"tblS3ToxicsAltReleases","ER_FedWilderness",,"An indication that federal wilderness areas are within a circle whose center is the point of the release and radius is determined by the distance to the endpoint for the alternative release scenario.","Yes/No",0
"tblS3ToxicsAltReleases","ER_NatlStateParks",,"An indication that national or state parks, forests, or monuments are within a circle whose center is the point of the release and radius is determined by
the distance to the endpoint for the alternative release scenario.","Yes/No",0
"tblS3ToxicsAltReleases","ER_OtherType",,"The type of environmental receptor if the environmental receptor is other than those listed in 3.14.a. through 3.14.c.","Text",0
"tblS3ToxicsAltReleases","ER_WildlifeSactuary",,"An indication that officially designated wildlife sanctuaries, preserves, or refuges are within a circle whose center is the point of the release and
radius is determined by the distance to the endpoint.","Yes/No",0
"tblS3ToxicsAltReleases","PercentWeight","3.1.b Percent weight of chemical in mixture","Percent weight of the regulated substance in the chemical evaluated.","Single",1
"tblS3ToxicsAltReleases","PhysicalState",,"Code representing the physical state of the toxic chemical as it is released in the scenario.","Text",0
"tblS3ToxicsAltReleases","PM_Berms",,"An indication that a mound or wall of earth at the top or bottom of a slope that prevents a spill from spreading is in place.","Yes/No",0
"tblS3ToxicsAltReleases","PM_Dikes",,"An indication that a low wall that acts as a barrier to prevent a spill from spreading is in place.","Yes/No",0
"tblS3ToxicsAltReleases","PM_Drains",,"An indication that a channel that carries off surface
water is in place.","Yes/No",0
"tblS3ToxicsAltReleases","PM_Enclosures",,"An indication that a physical containment of the release within a structure (e.g., a building) is in place.","Yes/No",0
"tblS3ToxicsAltReleases","PM_OtherType",,"The type of Passive Mitigation in place if the passive mitigation is other than those listed in 3.15.a. through 3.15.e.","Text",0
"tblS3ToxicsAltReleases","PM_Sumps",,"An indication that a pit or tank that catches liquid runoff for drainage or disposal is in place.","Yes/No",0
"tblS3ToxicsAltReleases","PR_Comm_Ind",,"An indication that a major commercial, office, or industrial area is within the distance to the endpoint specified in the alternative release scenario. These
include industrial parks, office buildings, shopping malls, commercial areas.","Yes/No",0
"tblS3ToxicsAltReleases","PR_Hospitals",,"An indication that a hospital is within the distance to the endpoint specified in the alternative release scenario.","Yes/No",0
"tblS3ToxicsAltReleases","PR_OtherType",,"The type of public receptor if the public receptor is other than those listed in 3.13.a. through 3.13.f.","Text",0
"tblS3ToxicsAltReleases","PR_Prisons",,"An indication that a prison or correction facility is within the distance to the endpoint specified in the alternative release scenario.","Yes/No",0
"tblS3ToxicsAltReleases","PR_PublicRecreation",,"An indication that a recreational area or arena is within the distance to the endpoint specified in the alternative release scenario. These include stadiums, parks, and public pools.","Yes/No",0
"tblS3ToxicsAltReleases","PR_Residences",,"An indication that residences are within the distance to the endpoint specified in the alternative release scenario.","Yes/No",0
"tblS3ToxicsAltReleases","PR_Schools",,"An indication that a school is within the distance to the endpoint specified in the alternative release scenario. Schools include public and private elementary, secondary, or higher education schools.","Yes/No",0
"tblS3ToxicsAltReleases","ProcessChemicalID",,"Unique number used to identify each chemical in a process from Section 1 Chemicals in Covered Process.  Generated by RMP*Submit and 3rd-party programs.","Long Integer",0
"tblS3ToxicsAltReleases","ptrGraphic",,"The type of active mitigation in place if other than those listed in 3.16.a. through 3.16.h.","Text",0
"tblS3ToxicsAltReleases","QuantityReleased","3.5 Quantity released (lbs)","The quantity of the chemical released during the alternative release scenario in pounds.","Double",1
"tblS3ToxicsAltReleases","ReleaseDuration","3.7 Release duration (min)","The a length of time in minutes for the vessel, pipeline, or other location of the regulated substance to release the quantity.","Single",1
"tblS3ToxicsAltReleases","ReleaseRate","3.6 Release rate (lbs/min)","The release rate in pounds per minute.","Double",1
"tblS3ToxicsAltReleases","ResidentialPopulation","3.12 Residential population within distance to endpoint","The residential population within the distance to endpoint potentially impacted by the toxics alternative release scenario.","Long Integer",1
"tblS3ToxicsAltReleases","Scenario",,"A description of the toxics alternative release scenario as follows: (a) Transfer hose failure is the failure of the connection between two or more
vessels; (b) Pipe leak is the release through a rupture in a pipe; (c) Vessel leak is a release through a rupture in a vessel; (d) Overfilling is release due to filling a pipe, vessel, or other container past its capacity; (e) Ruptured disk/relief valve is a release due to failure of a rupture disk/relief valve to function properly.  A rupture disk/relief valve is a valve that relieves pressure
beyond a specified limit; a relief valve re-closes upon return to normal operating conditions; (f) Excess flow device failure is a release caused by
the failure of excess flow device to function properly and prevent surges from reaching downstream equipment; and (g) any other scenario not in list. One of the following should be specified:
Transfer hose failure;
Pipe leak;
Vessel leak;
Overfilling;
Rupture disk/relief; Valve failure;
Excess flow device failure;
Other (specify).","Text",0
"tblS3ToxicsAltReleases","StabilityClass",,"A code (A through F) representing the average daily stability based on annual data collected at the site or local meteorological station.  List ""D,"" if
OCA guidance is used.  If scenario is modeled, use the average daily stability based on annual data collected at local meteorological station.","Text",0
"tblS3ToxicsAltReleases","Topography",,"A code representing the topography of the area potentially impacted by the alternative release scenario.","Text",0
"tblS3ToxicsAltReleases","ToxicID",,"Unique identifier for the Section 3 Toxics Alternative Release record destination table.  Generated by RMP*Submit and 3rd-party programs.","Long Integer",0
"tblS3ToxicsAltReleases","WindSpeed",,"The wind speed in meters per second.  List 3 m/s if RMP Offsite Consequence Analysis (OCA) guidance is used.  If scenario is modeled, indicate the average daily wind speed based on annual data collected at the local meteorological station.","Single",0
"tblS4FlammablesWorstCase","AnalyticalBasis",,"The analytical basis for choosing the Flammables Worst Case Scenario.  
One of the following should be specified:
EPA’s OCA Guidance Reference Tables or Equations; 
EPA’s RMP Guidance for Propane Storage
Reference Tables or Equations;
EPA’s RMP Guidance for Wastewater Treatment Plants Reference Tables or Equations;
EPA’s RMP Guidance for Warehouses Reference Tables or Equations;
EPA’s RMP Guidance for Chemical Distributors Reference Tables or Equations;
EPA’s RMP*Comp (TM);
Other Model Name.","Text",0
"tblS4FlammablesWorstCase","CBI_Flag",,"An indication that Confidential Business Information (CBI) was claimed for certain data elements in the record.","Yes/No",0
"tblS4FlammablesWorstCase","Distance2Endpoint","4.6 Distance to endpoint  (miles)","The distance to the end of the impact zone for the flammables worst case scenario.","Single",1
"tblS4FlammablesWorstCase","ER_FedWilderness",,"An indication that federal wilderness areas are within a circle whose center is the point of the release and radius is determined by the distance to the endpoint.","Yes/No",0
"tblS4FlammablesWorstCase","ER_NatlStateParks",,"An indication that national or state parks, forests, or monuments are within a circle whose center is the point of the release and radius is determined by
the distance to the endpoint.","Yes/No",0
"tblS4FlammablesWorstCase","ER_OtherType",,"The type of environmental receptor if the environmental receptor is other than those listed in 4.9.a. through 4.9.c.","Text",0
"tblS4FlammablesWorstCase","ER_WildlifeSactuary",,"An indication that officially designated wildlife sanctuaries, preserves, or refuges are within a circle whose center is the point of the release and
radius is determined by the distance to the endpoint.","Yes/No",0
"tblS4FlammablesWorstCase","FlammableID",,"Unique identifier for the flammables worst case record destination table.  Generated by RMP*Submit and 3rd-party programs.","Long Integer",0
"tblS4FlammablesWorstCase","PM_BlastWalls",,"An indication that a heavy wall used to isolate buildings or areas that contain highly combustible or explosive materials is in place.","Yes/No",0
"tblS4FlammablesWorstCase","PM_OtherType",,"The type of the passive mitigation considered if other than 4.10.a.","Text",0
"tblS4FlammablesWorstCase","PR_Comm_Ind",,"An indication that a major commercial, office, or industrial area is within the distance to the endpoint specified in the worst case scenario. These include
industrial parks, office buildings, shopping malls, commercial areas.","Yes/No",0
"tblS4FlammablesWorstCase","PR_Hospitals",,"An indication that a hospital is within the distance to the endpoint specified in the worst case scenario.","Yes/No",0
"tblS4FlammablesWorstCase","PR_OtherType",,"The type of public receptor if the public receptor is other than those listed in 4.8.a through 4.8.f.","Text",0
"tblS4FlammablesWorstCase","PR_Prisons",,"An indication that a prison or correction facility is within the distance to the endpoint specified in the worst case scenario.","Yes/No",0
"tblS4FlammablesWorstCase","PR_PublicRecreation",,"An indication that a recreational area or arena is within the distance to the endpoint specified in the worst case scenario. These include stadiums, parks, and public pools.","Yes/No",0
"tblS4FlammablesWorstCase","PR_Residences",,"An indication that residences are within the distance to the endpoint specified in the worst case scenario.","Yes/No",0
"tblS4FlammablesWorstCase","PR_Schools",,"An indication that a school is within the distance to the endpoint specified in the worst case scenario.  Schools include: public and private elementary,
secondary, or higher education schools.","Yes/No",0
"tblS4FlammablesWorstCase","ProcessChemicalID",,"Unique number used to identify each chemical in a process.  Generated by RMP*Submit and 3rd-party programs.","Long Integer",0
"tblS4FlammablesWorstCase","ptrGraphic",,"The DOS file name of the graphic file for the flammables worst case scenario.  Should be “.JPG” or “.GIF” with up to an 8-character prefix.","Text",0
"tblS4FlammablesWorstCase","QuantityReleased","4.4 Quantity released (lbs)","The quantity of the flammable chemical released in pounds.","Double",1
"tblS4FlammablesWorstCase","ResidentialPopulation","4.7 Residential population within distance to endpoint","The population within the distance to endpoint potentially impacted by the worst case scenario.","Long Integer",1
"tblS5FlammablesAltReleases","AM_DelugeSystems",,"An indication that a system to overflow an area of a release with water or other extinguishing fluid was considered.","Yes/No",0
"tblS5FlammablesAltReleases","AM_ExcessFlowValve",,"An indication that a system for diverting overflow was considered.","Yes/No",0
"tblS5FlammablesAltReleases","AM_OtherType",,"The type of active mitigation considered if other than those listed in 5.11.a through 5.11.d.","Text",0
"tblS5FlammablesAltReleases","AM_SprinklerSystems",,"An indication that a system for protecting against fire by means of overhead pipes which convey an extinguishing fluid through heat activated outlets was considered.","Yes/No",0
"tblS5FlammablesAltReleases","AM_WaterCurtain",,"An indication that a spray of water from a horizontal pipe through nozzles was considered.  The curtain may be activated manually or automatically.","Yes/No",0
"tblS5FlammablesAltReleases","AnalyticalBasis",,"The analytical basis for choosing the Flammables Alternative Release Scenario.","Text",0
"tblS5FlammablesAltReleases","CBI_Flag",,"An indication that Confidential Business Information (CBI) was claimed for certain data elements in the record.","Yes/No",0
"tblS5FlammablesAltReleases","Distance2Endpoint","5.6 Distance to endpoint  (miles)","The distance impacted by the flammable release in miles.","Single",1
"tblS5FlammablesAltReleases","EndpointUsed",,"The endpoint of the flammable reaction - “1 PSI” or “5 kw/m2 for 40 seconds” or “Lower flammability limit.”","Text",0
"tblS5FlammablesAltReleases","ER_FedWilderness",,"An indication that federal wilderness areas are within a circle whose center is the point of the release and radius is determined by the distance to the endpoint.","Yes/No",0
"tblS5FlammablesAltReleases","ER_NatlStateParks",,"An indication that national or state parks, forests, or monuments are within a circle whose center is the point of the release and radius is determined by the distance to the endpoint.","Yes/No",0
"tblS5FlammablesAltReleases","ER_OtherType",,"The type of environmental receptor if the environmental receptor is other than those listed in 5.9.a. through 5.9.c.","Text",0
"tblS5FlammablesAltReleases","ER_WildlifeSactuary",,"An indication that officially designated wildlife sanctuaries, preserves, or refuges are within a circle whose center is the point of the release and radius is determined by the distance to the endpoint.","Yes/No",0
"tblS5FlammablesAltReleases","FlammableID",,"Unique identifier for the Flammables Alternative Release record.  Generated by RMP*Submit and 3rd-party programs.","Long Integer",0
"tblS5FlammablesAltReleases","LFL_Value","5.5 LFL Value (% Volume)","The lower flammability limit in units of percent volume.","Single",1
"tblS5FlammablesAltReleases","PM_BlastWalls",,"An indication that a heavy wall used to isolate buildings or areas that contain highly combustible or explosive materials is in place.","Yes/No",0
"tblS5FlammablesAltReleases","PM_Dikes",,"An indication that a low wall that acts as a barrier to prevent a spill from spreading is in place.","Yes/No",0
"tblS5FlammablesAltReleases","PM_Enclosures",,"An indication that a type of physical containment of the release within a structure (e.g., a building) is in place.","Yes/No",0
"tblS5FlammablesAltReleases","PM_FireWalls",,"An indication that a wall constructed to prevent the spread of fire is in place.","Yes/No",0
"tblS5FlammablesAltReleases","PM_OtherType",,"The type of the passive mitigation considered if other than those listed in 5.10.a. through 5.10.d.","Text",0
"tblS5FlammablesAltReleases","PR_Comm_Ind",,"An indication that a major commercial, office, or industrial area is within the distance to the endpoint specified in the alternative release scenario. These
include industrial parks, office buildings, shopping malls, and commercial areas.","Yes/No",0
"tblS5FlammablesAltReleases","PR_Hospitals",,"An indication that a hospital is within the distance to the endpoint specified in the alternative release scenario.","Yes/No",0
"tblS5FlammablesAltReleases","PR_OtherType",,"The type of public receptor if the public receptor is other than those listed in 5.8.a. through 5.8.f.","Text",0
"tblS5FlammablesAltReleases","PR_Prisons",,"An indication that a prison or correction facility is within the distance to the endpoint specified in the alternative release scenario.","Yes/No",0
"tblS5FlammablesAltReleases","PR_PublicRecreation",,"An indication that a recreational area or arena is within the distance to the endpoint specified in the alternative release scenario. These include stadiums, parks, and public pools.","Yes/No",0
"tblS5FlammablesAltReleases","PR_Residences",,"An indication that residences are within the distance to the endpoint specified in the alternative release scenario.","Yes/No",0
"tblS5FlammablesAltReleases","PR_Schools",,"An indication that a school is within the distance to the endpoint specified in the alternative release scenario.  Schools include: public and private elementary, secondary, and  higher education schools.","Yes/No",0
"tblS5FlammablesAltReleases","ProcessChemicalID",,"From Section 1 Chemicals in Covered Process, the Process Chemical Identifier is a number unique to the chemical that is being reported and is used to identify each chemical within a process.  Generated by RMP*Submit and 3rd-party programs.","Long Integer",0
"tblS5FlammablesAltReleases","ptrGraphic",,"The file name of the graphics file for the flammable alternative release scenario.  Should be “.JPG,” or “.GIF” with up to an 8-character prefix.","Text",0
"tblS5FlammablesAltReleases","QuantityReleased","5.4 Quantity released (lbs)","The quantity of the flammable chemical released in pounds.","Double",1
"tblS5FlammablesAltReleases","ResidentialPopulation","5.7 Residential population within distance to endpoint","The population within the distance to endpoint potentially impacted by the alternative release.","Long Integer",1
"tblS5FlammablesAltReleases","Scenario",,"The type of flammable release scenario.   One of the following should be specified:
Vapor cloud explosion;
Fireball;
BLEVE;
Pool fire;
Jet fire;
Vapor cloud fire;
Other (specify).","Text",0
"tblS6AccidentChemicals","AccidentChemicalID",,"Unique identifier for the Five-year Accident History record.  Generated by RMP*Submit and 3rd-party programs.","Long Integer",0
"tblS6AccidentChemicals","AccidentHistoryID",,"Unique identifier for the Five-year Accident History record.  Generated by RMP*Submit and 3rd-party programs.","Long Integer",0
"tblS6AccidentChemicals","ChemicalID",,"Chemical Abstract Service (CAS) registry number for the chemical released.","Long Integer",0
"tblS6AccidentChemicals","PercentWeight","6.5.c Percent Weight","Percent weight of chemical in release. This applies to toxic chemicals only.","Single",1
"tblS6AccidentChemicals","QuantityReleased","6.5.b Quantity released (lbs)","The amount of the chemical released in pounds.","Double",1
"tblS6AccidentHistory","AccidentDate",,"Date of the accident.","Date/Time",0
"tblS6AccidentHistory","AccidentHistoryID",,"Unique identifier for the Five-year Accident History record.  Generated by RMP*Submit and 3rd-party programs.","Long Integer",0
"tblS6AccidentHistory","AccidentReleaseDuration",,"Approximate length of time of the release in hours and minutes.","Text",0
"tblS6AccidentHistory","AccidentTime",,"Time of the accident (Military Time).","Text",0
