Table,Field,ShortDesc,Description,DataType,VisibleInRanking
"tblS6AccidentHistory","CBI_Flag",,"An indication that Confidential Business Information (CBI) was claimed for certain data elements in the record.","Yes/No",0
"tblS6AccidentHistory","CF_BypassCondition",,"A pipe or channel that provides an alternative pathway that detours the main pathway fails releasing a substance.","Yes/No",0
"tblS6AccidentHistory","CF_EquipmentFailure",,"A device or piece of equipment did not function as designed thereby allowing a substance to be released.","Yes/No",0
"tblS6AccidentHistory","CF_HumanError",,"An operator performs an operation improperly or makes a mistake resulting in a release.","Yes/No",0
"tblS6AccidentHistory","CF_ImproperProcedure",,"The procedure did not reflect the current method of operation, the procedure omitted steps that affected the accident, or the procedure was written in a
manner that allowed for misinterpretation of the instructions.","Yes/No",0
"tblS6AccidentHistory","CF_Maintenance",,"Any failure that occurs because of maintenance activity or inactivity.","Yes/No",0
"tblS6AccidentHistory","CF_ManagementError",,"This may be used to describe failures that occur because management did not exercise its managerial control to prevent the situation from
occurring.  This is usually used to describe faulty procedures, inadequate training, or failure to follow existing administrative procedures.","Yes/No",0
"tblS6AccidentHistory","CF_Other",,"A description of the factor that contributed to the accident occurring if other than those listed in 6.12.a. through 6.12.k.","Text",0
"tblS6AccidentHistory","CF_Overpressurization",,"The process was operated at pressures exceeding the design working pressure.","Yes/No",0
"tblS6AccidentHistory","CF_ProcessDesignFailure",,"Any failure that occurs because of an inherent flaw in the design of the process.","Yes/No",0
"tblS6AccidentHistory","CF_UnsuitableEquipment",,"The equipment used was incorrect for the process.","Yes/No",0
"tblS6AccidentHistory","CF_UnusualWeather",,"Weather conditions, such as lightning, hail, ice storms, tornados, hurricanes, floods, or high winds caused the accident.","Yes/No",0
"tblS6AccidentHistory","CF_UpsetCondition",,"The process was operated at pressures exceeding the design working pressure.","Yes/No",0
"tblS6AccidentHistory","CI_ChangedProcess",,"An indication that the process was changed.","Yes/No",0
"tblS6AccidentHistory","CI_ImprovedEquipment",,"A device or piece of equipment that did not function as designed was repaired or replaced.","Yes/No",0
"tblS6AccidentHistory","CI_NewMitigationSystems",,"New mitigation systems were initiated to limit accidental releases.","Yes/No",0
"tblS6AccidentHistory","CI_NewProcessControls",,"New process designs and controls were installed to correct problems and prevent recurrence of an accidental release.","Yes/No",0
"tblS6AccidentHistory","CI_None",,"An indication that none of the measures were taken at the facility to prevent recurrence of the accident.","Yes/No",0
"tblS6AccidentHistory","CI_OtherType",,"The name of the change introduced if other than one of the choices listed above.","Text",0
"tblS6AccidentHistory","CI_ReducedInventory",,"An indication that Inventory was reduced at the source to prevent accidental release.","Yes/No",0
"tblS6AccidentHistory","CI_RevisedERPlan",,"The emergency response plan was revised.","Yes/No",0
"tblS6AccidentHistory","CI_RevisedMaintenance",,"Maintenance processes were clarified or changed to ensure employees and contract employees are aware of and are practicing correct safety, process,
and administrative procedures.","Yes/No",0
"tblS6AccidentHistory","CI_RevisedOpProcedures",,"Operating procedures were clarified or changed to ensure that employees and contract employees are trained on process operating procedures.","Yes/No",0
"tblS6AccidentHistory","CI_RevisedTraining",,"Training programs were clarified or changed to ensure that employees and contract employees are aware of and are practicing correct safety, process,
and administrative procedures.","Yes/No",0
"tblS6AccidentHistory","DeathsPublic","6.9.a.iii On-site impacts: Deaths: Public","The number of public killed onsite during the accident or performing any mitigation activities.","Long Integer",1
"tblS6AccidentHistory","DeathsPublicResponders","6.9.a.ii On-site impacts: Deaths: Public responders","The number of public responders killed onsite during the accident or performing any mitigation activities.","Long Integer",1
"tblS6AccidentHistory","DeathsWorkers","6.9.a.i On-site impacts: Deaths: Employees or contractors","The number of workers or contractors killed onsite during the accident or performing any mitigation activities.","Long Integer",1
"tblS6AccidentHistory","ED_Kills",,"An indication that the type of environmental damage that occurred involved fish or animal kills.","Yes/No",0
"tblS6AccidentHistory","ED_MinorDefoliation",,"An indication that the type of environmental damage that occurred involved tree, lawn, shrub, or crop damage.","Yes/No",0
"tblS6AccidentHistory","ED_Other",,"The name of the other type of environmental damage that occurred if other than those listed in 6.10.g.1 through 6.10.g.4.","Text",0
"tblS6AccidentHistory","ED_SoilContamination",,"An indication that the type of environmental damage that occurred involved soil contamination.","Yes/No",0
"tblS6AccidentHistory","ED_WaterContamination",,"An indication that the type of environmental damage that occurred involved water contamination.","Yes/No",0
"tblS6AccidentHistory","Evacuated","6.10.d Known off-site impacts: Evacuated","The number of people evacuated.","Double",1
"tblS6AccidentHistory","FacilityID",,"Unique identifier for all RMPs submitted by a specific facility (assigned by Reporting Center for first-time submission). * After this number is assigned to the first submission for a facility, subsequent submissions for the same facility must include this identifier.","Long Integer",0
"tblS6AccidentHistory","Hospitalization","6.10.b Known off-site impacts: Hospitalizations","The total number of injuries to the community attributable to the accident that required hospitalization.","Double",1
"tblS6AccidentHistory","InitiatingEvent",,"The name of the other type of environmental damage that occurred if other than those listed in 6.10.g.1 through 6.10.g.4.","Text",0
"tblS6AccidentHistory","InjuriesPublic","6.9.b.iii On-site impacts: Injuries: Public","The number of public injured onsite during the accident or performing any mitigation activities.","Long Integer",1
"tblS6AccidentHistory","InjuriesPublicResponders","6.9.b.ii On-site impacts: Injuries: Public responders","The number of public responders injured onsite during the accident or performing any mitigation activities.","Long Integer",1
"tblS6AccidentHistory","InjuriesWorkers","6.9.b.i On-site impacts: Injuries: Employees or contractors","The number of workers or contractors injured onsite during the accident or performing any mitigation activities.","Long Integer",1
"tblS6AccidentHistory","MedicalTreatment","6.10.c Known off-site impacts: Other medical treatment","The number of injuries to the community that required medical treatment, not including first aid.","Double",1
"tblS6AccidentHistory","NAICSCode",,"The 5- or 6- digit NAICS code.","Text",0
"tblS6AccidentHistory","OffsiteDeaths","6.10.a Known off-site impacts: Deaths","The number of offsite deaths attributable to the accident.","Long Integer",1
"tblS6AccidentHistory","OffsitePropertyDamage","6.10.f Known off-site impacts: Property damage ($)","Estimated value of the off-site property damage, in whole American dollars, caused by the accident, including damage to response equipment.","Double",1
"tblS6AccidentHistory","OffsiteRespondersNotify",,"Indication of whether agencies were contacted:
	Notified only
	Notified Responded
	No, not notified
	Unknown
Users may add their own data if it is not on the list.","Text",0
"tblS6AccidentHistory","OnsitePropertyDamage","6.9.c On-site impacts: Injuries: Property damage","Value of the equipment or business structures that were damaged by the accident or mitigation activities at the facility, in whole U.S. dollars.","Double",1
"tblS6AccidentHistory","OtherReleaseSource",,"Value of the equipment or business structures that were damaged by the accident or mitigation activities at the facility, in whole U.S. dollars.","Text",0
"tblS6AccidentHistory","Precipitation",,"An indicator of whether precipitation was present at the time of the accident.","Yes/No",0
"tblS6AccidentHistory","RE_Explosion",,"Rapid chemical reaction with the production of noise, heat, and violent expansion of gases.","Yes/No",0
"tblS6AccidentHistory","RE_Fire",,"Product (e.g., fuel) in a state of combustion.","Yes/No",0
"tblS6AccidentHistory","RE_Gas",,"Release of the substance in a vapor state.","Yes/No",0
"tblS6AccidentHistory","RE_Spill",,"Release of the substance in a liquid state with subsequent vaporization.","Yes/No",0
"tblS6AccidentHistory","RS_Joint",,"The surface at which two or more mechanical components are united.","Yes/No",0
"tblS6AccidentHistory","RS_Piping",,"System of pipes used to carry a fluid.","Yes/No",0
"tblS6AccidentHistory","RS_ProcessVessel",,"Container in which regulated substances are blended to form a mixture or reacted to convert them into some other final product or form.","Yes/No",0
"tblS6AccidentHistory","RS_Pump",,"Device that raises, transfers, or compresses fluids or that attenuates gases by suction or pressure or both.","Yes/No",0
"tblS6AccidentHistory","RS_StorageVessel",,"Container for storing, holding, or transporting a liquid.","Yes/No",0
"tblS6AccidentHistory","RS_TransferHose",,"Connection between two or more vessels.","Yes/No",0
"tblS6AccidentHistory","RS_Valve",,"Structure that closes temporarily a passage or permits movement of fluid in one direction only.","Yes/No",0
"tblS6AccidentHistory","ShelteredInPlace","6.10.e Known off-site impacts: Sheltered-in-place","Number of community members sheltered-in-place (ordered by the incident commander to remain inside their residence or place of work until the emergency is over).","Double",1
"tblS6AccidentHistory","StabilityClass",,"A general indication of the degree of mixing present in the atmosphere accounting for wind speed and sunlight, where ""A"" represents extremely unstable conditions and ""F"" represents calm conditions.","Text",0
"tblS6AccidentHistory","Temperature",,"The ambient temperature at the scene of the accident in degrees Fahrenheit.","Single",0
"tblS6AccidentHistory","WeatherUnknown",,"A flag indicating the weather conditions at the time of the accident are unknown.","Yes/No",0
"tblS6AccidentHistory","WindDirection",,"Direction from which the wind comes using standard compass reading.","Text",0
"tblS6AccidentHistory","WindSpeed",,"An estimate of how fast the wind is traveling.","Single",0
"tblS6AccidentHistory","WindSpeedUnitCode",,"Unit code for wind speed.","Text",0
"tblS6FlammableMixtureChemicals","AccidentChemicalID",,"Unique identifier for each Accident History flammable mixture chemical.  Generated by RMP*Submit and 3rd-party programs.","Long Integer",0
"tblS6FlammableMixtureChemicals","ChemicalID",,"Chemical Abstract Service (CAS) registry number for the flammable mixture chemical released.","Long Integer",0
"tblS6FlammableMixtureChemicals","FlamMixChemID",,"Unique identifier for the Accident Flammable Mixture Chemical record.  Generated by RMP*Submit and 3rd-party programs.","Long Integer",0
"tblS7_Prevention_Program_Chemicals","PreventionProgram3ID",,"A unique number used to identify each prevention program within a NAICS code within a process.  Generated by RMP*Submit and 3rd-party programs.","Long Integer",0
"tblS7_Prevention_Program_Chemicals","PrimaryKey",,"Unique identifier for the Prevention Program 3 chemicals record destination table.  Generated by RMP*Submit and 3rd-party programs.","Long Integer",0
"tblS7_Prevention_Program_Chemicals","ProcessChemicalID",,"A number used to identify each chemical within a single RMP from Section 1 Chemicals in Covered Process.  Generated by RMP*Submit and 3rd-party
programs.","Long Integer",0
"tblS7PreventionProgram3","AuditCompletionDate",,"The expected or actual date of completion of all changes resulting from the compliance audit.","Date/Time",0
"tblS7PreventionProgram3","CBI_Flag",,"An indication that Confidential Business Information (CBI) was claimed for certain data elements in the record.","Yes/No",0
"tblS7PreventionProgram3","CH_ChangeProcessParameters",,"An increase or decrease in temperature, pressure, flow rates, etc.","Yes/No",0
"tblS7PreventionProgram3","CH_ChemicalIncrease",,"An  increase in the quantity of regulated substances stored on site.","Yes/No",0
"tblS7PreventionProgram3","CH_ChemicalReduction",,"A decrease in the quantity of regulated substances stored on site.","Yes/No",0
"tblS7PreventionProgram3","CH_InstallMitigationSystems",,"Additional mitigation systems have been put in place.","Yes/No",0
"tblS7PreventionProgram3","CH_InstallPerimeterMonitoring",,"Additional perimeter monitoring systems have been installed to detect a release of a regulated substance from the process.","Yes/No",0
"tblS7PreventionProgram3","CH_InstallProcessControls",,"The addition of process controls used to prevent or limit releases.","Yes/No",0
"tblS7PreventionProgram3","CH_InstallProcessDetection",,"Additional detection systems have been installed to detect a release of a regulated substance from the process.","Yes/No",0
"tblS7PreventionProgram3","CH_None",,"No Changes since last PHA update.","Yes/No",0
"tblS7PreventionProgram3","CH_NoneRequired",,"The PHA or hazard review team did not recommend any changes to the process.","Yes/No",0
"tblS7PreventionProgram3","CH_OtherChanges",,"Any other changes made to the process since the last PHA or hazard review.","Text",0
"tblS7PreventionProgram3","ChangeMgmtDate",,"The date of the most recent change that triggered management of change procedures.","Date/Time",0
"tblS7PreventionProgram3","ChangeMgmtReviewDate",,"The date of the most recent review or revision of management of change procedures.","Date/Time",0
"tblS7PreventionProgram3","ComplianceAuditDate",,"Date of the most recent compliance audit.  Required if a resubmission.","Date/Time",0
"tblS7PreventionProgram3","ContractorSafetyEvalDate",,"Date of most recent evaluation of contractor safety performance.","Date/Time",0
"tblS7PreventionProgram3","ContractorSafetyReviewDate",,"Date of most recent review or revision of contractor safety procedures.","Date/Time",0
"tblS7PreventionProgram3","CT_Demonstration",,"A demonstration was given to determine and evaluate employee comprehension of training materials.","Yes/No",0
"tblS7PreventionProgram3","CT_Observation",,"Employees were observed to determine and evaluate employee comprehension of training materials.","Yes/No",0
"tblS7PreventionProgram3","CT_OralTest",,"An oral test was given to determine and evaluate employee comprehension of training materials.","Yes/No",0
"tblS7PreventionProgram3","CT_OtherType",,"The type of competency test used if other than the values for Competency Test.","Text",0
"tblS7PreventionProgram3","CT_WrittenTest",,"A written test was given to determine and evaluate employee comprehension of training materials.","Yes/No",0
"tblS7PreventionProgram3","Description",,"The Prevent Program includes an optional description field.","Memo",0
"tblS7PreventionProgram3","EquipmentInspectionDate",,"The date of the most recent equipment inspection or test.","Date/Time",0
"tblS7PreventionProgram3","EquipmentTested",,"The equipment tested or inspected.","Text",0
"tblS7PreventionProgram3","HotWorkPermitReviewDate",,"Date of most recent review or revision of hot work permit procedures.","Date/Time",0
"tblS7PreventionProgram3","IncidentInvestigationDate",,"The date of the most recent incident investigation.","Date/Time",0
"tblS7PreventionProgram3","InvestigationChangeDate",,"The expected or actual date of completion of any changes resulting from an investigation.","Date/Time",0
"tblS7PreventionProgram3","MaintenanceReviewDate",,"The date of most recent review or revision of maintenance procedures.","Date/Time",0
"tblS7PreventionProgram3","MD_None",,"No Monitoring or detection in Use.","Yes/No",0
"tblS7PreventionProgram3","MD_OtherType",,"The type of monitoring or detection system in place if other than the ones listed above.","Text",0
"tblS7PreventionProgram3","MD_PerimeterMonitors",,"Integrated detection networks at the source boundary.  Detection systems can include fluorescent SO2 analyzers, photoelectric tape sensors, or electrolytic chlorine detectors.","Yes/No",0
"tblS7PreventionProgram3","MD_ProcessAreaDetectors",,"Detection systems located on or close to process equipment.  Detection systems include indicator tubes, and chromatographic, spectrometric, electrochemical, and colorimetric gas analysis.","Yes/No",0
"tblS7PreventionProgram3","MH_Contamination",,"A release could occur if inappropriate substances are introduced into storage or process vessels.  Contamination may be a major hazard when
controlling inappropriate substances (e.g., H2O) is difficult.","Yes/No",0
"tblS7PreventionProgram3","MH_CoolingLoss",,"These losses could be major hazards if they could lead to releases.  For example, loss of cooling could lead to an increase in pressure and failure of
a vessel or pipe, and a loss of heating or power could lead to unstable processes.","Yes/No",0
"tblS7PreventionProgram3","MH_Corrosion",,"The presence of the regulated substance could lead to destruction of equipment and a release.  Corrosion may be a major hazard for substances
identified as corrosives on Material Safety Data Sheets unless the equipment used limits the hazard.","Yes/No",0
"tblS7PreventionProgram3","MH_Earthquake",,"Report earthquakes as a major hazard only if they occur or are likely to occur at your site such that you design and plan for them.","Yes/No",0
"tblS7PreventionProgram3","MH_EquipmentFailure",,"Equipment failure will be a major hazard for most processes because such failure could lead to a release.  Equipment failure includes cracks, weld
failures, disk failures, ruptures, pump/gauge/control system failures, etc.","Yes/No",0
"tblS7PreventionProgram3","MH_Explosion",,"Confined or unconfined vapor cloud explosions.","Yes/No",0
"tblS7PreventionProgram3","MH_Fire",,"Process upsets, leaks, equipment failure, etc., could result in a fire.","Yes/No",0
"tblS7PreventionProgram3","MH_Floods",,"Report floods as a major hazard only if they occur or are likely to occur at your site such that you design and plan for them.","Yes/No",0
"tblS7PreventionProgram3","MH_Hurricanes",,"Report hurricanes as a major hazard only if they occur or are likely to occur at your site such that you design and plan for them.","Yes/No",0
"tblS7PreventionProgram3","MH_OtherType",,"The name of the major hazard if other than those listed in 7.4.d.1. through 7.4.d.15.","Text",0
"tblS7PreventionProgram3","MH_Overfilling",,"Filling a tank or vessel beyond its maximum safe capacity.","Yes/No",0
"tblS7PreventionProgram3","MH_Overpressurization",,"Instantaneous energy release or detonation.","Yes/No",0
"tblS7PreventionProgram3","MH_Polymerization",,"A chemical reaction that produces the bonding of two or more monomers.","Yes/No",0
"tblS7PreventionProgram3","MH_RunawayReaction",,"An uncontrolled reaction that proceeds at an increasing rate.","Yes/No",0
"tblS7PreventionProgram3","MH_Tornado",,"Report tornados as a major hazard only if they occur or are likely to occur at your site such that you design and plan for them.","Yes/No",0
"tblS7PreventionProgram3","MH_ToxicRelease",,"If an accidental release occurred a regulated toxic substance could be released.","Yes/No",0
"tblS7PreventionProgram3","MS_BlastWalls",,"A heavy wall used to isolate buildings or areas that contain highly combustible or explosive materials.","Yes/No",0
"tblS7PreventionProgram3","MS_DelugeSystem",,"A system to overflow an area of a release with water or other extinguishing fluid.","Yes/No",0
"tblS7PreventionProgram3","MS_Dikes",,"A low wall that acts as a barrier to prevent a spill from spreading.","Yes/No",0
"tblS7PreventionProgram3","MS_Enclosure",,"A physical containment of the release within a structure (e.g., a building).","Yes/No",0
"tblS7PreventionProgram3","MS_FireWalls",,"A wall constructed to prevent the spread of fire.","Yes/No",0
"tblS7PreventionProgram3","MS_Neutralization",,"Something that facilitates and controls the release by neutralizing the released chemical.","Yes/No",0
"tblS7PreventionProgram3","MS_None",,"No Mitigation systems in Use.","Yes/No",0
"tblS7PreventionProgram3","MS_OtherType",,"The type of the mitigation system in use if other than one of the choices above.","Text",0
"tblS7PreventionProgram3","MS_SprinklerSystem",,"A system for protecting a building against fire by means of overhead pipes that release an extinguishing fluid through heat activated outlets.","Yes/No",0
"tblS7PreventionProgram3","MS_WaterCurtain",,"A spray of water from a horizontal pipe through nozzles.  The curtain may be activated manually or automatically.","Yes/No",0
"tblS7PreventionProgram3","OpProceduresReviewDate",,"Date of most recent review of revision to operating procedures.","Date/Time",0
"tblS7PreventionProgram3","ParticipationPlansReviewDate",,"Date of most recent review or revision of employee participation plans.","Date/Time",0
"tblS7PreventionProgram3","PC_Alarms",,"Systems that operate a warning device after the occurrence of a Hazardous condition and procedures to activate the alarm system.","Yes/No",0
"tblS7PreventionProgram3","PC_AutomaticShutoffs",,"Controls the shutoff flow to a pipe or vessel and are triggered automatically when process conditions are exceeded.","Yes/No",0
"tblS7PreventionProgram3","PC_BackupPump",,"A secondary pump intended to serve the same function as the primary pump if the primary pump fails.","Yes/No",0
"tblS7PreventionProgram3","PC_CheckValves",,"A device for automatically limiting the flow in a piping system to a single direction.","Yes/No",0
"tblS7PreventionProgram3","PC_EmergencyAirSupply",,"A backup system to provide air to a process when the regular air supply fails.","Yes/No",0
"tblS7PreventionProgram3","PC_EmergencyPower",,"Backup power systems.","Yes/No",0
"tblS7PreventionProgram3","PC_ExcessFlowDevice",,"Flow-limiting equipment that protects downstream equipment from surges.","Yes/No",0
"tblS7PreventionProgram3","PC_Flares",,"A pre-release protection measure used for flammable gases and vapors to remove and possibly treat discharged liquids.","Yes/No",0
"tblS7PreventionProgram3","PC_GroundingEquipment",,"Devices that ground electrical equipment to avoid explosions.","Yes/No",0
"tblS7PreventionProgram3","PC_InhibitorAddition",,"A substance that is added to a reaction that is capable of stopping or retarding a chemical reaction.","Yes/No",0
"tblS7PreventionProgram3","PC_Interlocks",,"A switch or other device that prevents activation of a piece of equipment when a protective door is open or some other hazard exists.","Yes/No",0
"tblS7PreventionProgram3","PC_KeyedBypass",,"A bypass system that is activated by a control signal.","Yes/No",0
"tblS7PreventionProgram3","PC_ManualShutoffs",,"Manual controls of the shutoff flow to a pipe or vessel.","Yes/No",0
"tblS7PreventionProgram3","PC_None",,"No Process Controls in Use.","Yes/No",0
"tblS7PreventionProgram3","PC_OtherType",,"The name of the process control if other than those listed in 7.4.e.1. through 7.4.e.19.","Text",0
"tblS7PreventionProgram3","PC_PurgeSystem",,"A system that replaces the atmosphere in a container with an inert substance to prevent the formation of an explosive mixture.","Yes/No",0
"tblS7PreventionProgram3","PC_QuenchSystem",,"A system that cools by removing excess heat or immersing liquid into a cooling medium.","Yes/No",0
"tblS7PreventionProgram3","PC_ReliefValves",,"A valve that relieves pressure beyond a specified limit and re-closes upon return to normal operating procedures.","Yes/No",0
"tblS7PreventionProgram3","PC_RuptureDisks",,"A device that relieves pressure beyond a specified limit.","Yes/No",0
"tblS7PreventionProgram3","PC_Scrubbers",,"A pre-release protection measure that uses water or aqueous mixtures containing scrubbing reagents to remove discharging liquids and may treat the discharging chemical.","Yes/No",0
"tblS7PreventionProgram3","PC_Vents",,"An opening provided for the discharge of pressure or release of pressure from tanks, vessels, processing equipment, etc.","Yes/No",0
"tblS7PreventionProgram3","PHA_Checklist",,"This technique involves developing a checklist of failure areas and reviewing each area to determine the possible effects of failure.","Yes/No",0
"tblS7PreventionProgram3","PHA_Date",,"Date of completion of the most recent Process Hazard Analysis (PHA) or update.","Date/Time",0
"tblS7PreventionProgram3","PHA_FMEA",,"This is a methodology of tabulating the source's equipment, failure modes (how equipment fails), each failure mode's effect on the source, and a
ranking of each failure mode.","Yes/No",0
"tblS7PreventionProgram3","PHA_FTA",,"This is a deductive technique that focuses on one particular accident event and provides a method for determining causes of the event. The fault tree is a
graphic model that displays the various combinations of equipment faults and failures that can result in a release.","Yes/No",0
"tblS7PreventionProgram3","PHA_HAZOP",,"Hazard and Operability Studies (HAZOPs) are conducted by teams that brainstorm to systematically identify hazards or operability problems through the use of certain guidewords.","Yes/No",0
"tblS7PreventionProgram3","PHA_OtherTechnique",,"The name of the PHA technique used if other than 7.4.b.1 through 7.4.b.6.","Text",0
